organization_id,name,organization_type,target_lists,status,city,website,linkedin_url,source_kind,source_url,discovered_at,last_updated_at,notes
org-splash-inc,Splash Inc.,startup,yc;startup;la,Discovered,Los Angeles,,,yc_directory,https://www.ycombinator.com/companies/splash-inc,2026-05-27T12:03:07+00:00,2026-05-27T12:03:07+00:00,"batch=W2025 | team_size=9 employees | location=Los Angeles | description=Splash is developing the next generation of autonomous surface vessels (ASVs) to provide National Security and defend critical assets such as oil rigs and shipping terminals. Our long-term vision is to make traditional naval vessels obsolete by creating a fleet of low-cost and versatile boats which will be able to dominate the seas. Our expertise in mass manufacturing, engineering and quickly scaling operations will make this vision a reality."
org-orbital-operations,Orbital Operations,startup,yc;startup;la,Discovered,Los Angeles,,,yc_directory,https://www.ycombinator.com/companies/orbital-operations,2026-05-27T12:03:07+00:00,2026-05-27T12:03:07+00:00,"batch=W2025 | team_size=2 employees | location=Los Angeles | description=Orbital Operations is developing a high thrust, reusable space vehicle for satellite defense. We protect critical satellites, like GPS and Military communication satellites, from adversarial threats, like China and Russia. Our vehicle will use the exact same propulsion systems that launch vehicles have used for decades by implementing a cryogenic management system. This will give us over 100x the thrust or current in-space propulsion. Ross and I have over 15 years of combined aerospace experience across NASA, Aerojet Rocketdyne, SpaceX, Blue Origin, and Relativity Space. We’ve worked side by side for more than 3.5 years developing propulsion systems, turbomachinery, and building our own respective engineering teams. We are currently working on the first demo of our unique cryo management system and intend to launch an operational vehicle by 2027."
org-endstack,Endstack,startup,yc;startup;la,Discovered,Los Angeles,,,yc_directory,https://www.ycombinator.com/companies/endstack,2026-05-27T12:03:07+00:00,2026-05-27T12:03:07+00:00,"batch=F2024 | team_size=2 employees | location=Los Angeles, CA, USA | tags=generative-ai,developer-tools,artificial-intelligence,ai-assistant | description=Endstack is a desktop OS optimized for humans and agents running in the cloud. Your desktop is powered by endOS, giving you a real desktop workspace in the browser backed by Linux in the cloud. Files, notes, browser tabs, native apps, terminals, and all your agents in one beautiful, familiar, interface. You get a powerful agent running 24/7, integrated at the system level into endOS that you can also reach via Slack, email, or SMS. Endstack desktops are also natively multiplayer, allowing for realtime collaboration with teammates."
org-ares-industries,Ares Industries,startup,yc;startup;la,Discovered,Los Angeles,,,yc_directory,https://www.ycombinator.com/companies/ares-industries,2026-05-27T12:03:07+00:00,2026-05-27T12:03:07+00:00,"batch=S2024 | team_size=2 employees | location=Los Angeles | tags=aerospace,industrial"
org-voker,Voker,startup,yc;startup;la,Discovered,Los Angeles,,,yc_directory,https://www.ycombinator.com/companies/voker,2026-05-27T12:03:07+00:00,2026-05-27T12:03:07+00:00,"batch=S2024 | team_size=6 employees | location=Los Angeles, CA, USA | tags=analytics,big-data,developer-tools,ai,generative-ai | description=Voker is the Agent Analytics Platform for monitoring and improving your AI agents. Companies like Dutch.com use our SDK to build better agents. Alex and Tyler met at a high-growth E-Commerce startup where Tyler was running Technology & Data. Together, they built AI products that bootstrapped the company profitably to $100MM in Revenue."
org-sonatoria,Sonatoria,startup,yc;startup;la,Discovered,Los Angeles,,,yc_directory,https://www.ycombinator.com/companies/sonatoria,2026-05-27T12:03:07+00:00,2026-05-27T12:03:07+00:00,batch=S2024 | team_size=2 employees | location=Los Angeles
org-bae-systems-inc,"BAE Systems, Inc.",company,built_in;la;companies,Researching,Los Angeles,,,startup_directory,https://www.builtinla.com/company/bae-systems,2026-05-27T12:03:09+00:00,2026-05-27T12:03:09+00:00,"team_size=40,000 Employees | location=23 Offices | jobs_count=1 | tags=aerospace,hardware,information technology,security,software,cybersecurity,defense | description=Improving the future and protecting lives is an ambitious mission, but it’s what we do. As a leading aerospace, defense, and security company, we work together to deliver a full range of products and services for air, land, space, and naval forces, as well as advanced electronics, security, information technology solutions and customer support services. How we work is rooted..."
org-block,Block,company,built_in;la;companies,Researching,Los Angeles,,,startup_directory,https://www.builtinla.com/company/block-inc,2026-05-27T12:03:09+00:00,2026-05-27T12:03:09+00:00,"team_size=12,000 Employees | location=23 Offices | jobs_count=1 | tags=blockchain,ecommerce,fintech,payments,software,financial services,cryptocurrency | description=Block, Inc. is a global technology company with a focus on financial services. Made up of Square, Cash App, Afterpay, TIDAL, Bitkey, and Proto, Block, Inc. builds technology to increase access to the global economy. Each of our brands unlocks different aspects of the economy for more people. Square makes commerce and financial services accessible to sellers. Cash App is the..."
org-boeing,Boeing,company,built_in;la;companies,Researching,Los Angeles,,,startup_directory,https://www.builtinla.com/company/boeing,2026-05-27T12:03:09+00:00,2026-05-27T12:03:09+00:00,"team_size=170,000 Employees | location=33 Offices | jobs_count=1 | tags=aerospace,information technology,software,cybersecurity,design,defense,manufacturing | description=A leading global aerospace company and top U.S. exporter, Boeing develops, manufactures and services commercial airplanes, defense products and space systems for customers in more than 150 countries. Our U.S. and global workforce and supplier base drive innovation, economic opportunity, sustainability and community impact. Boeing is committed to fostering a culture based on our core values of safety, quality and..."
org-munchkin-inc,"Munchkin, Inc.",company,built_in;la;companies,Researching,Los Angeles,,,startup_directory,https://www.builtinla.com/company/munchkin-inc,2026-05-27T12:03:09+00:00,2026-05-27T12:03:09+00:00,"team_size=325 Employees | location=6 Offices | jobs_count=1 | tags=consumer web,ecommerce,food,kids+family,design,manufacturing | description=WHY Brands Inc., a parent company of Munchkin and Curio Home Goods, focuses on creating, incubating, and growing the next generation of consumer lifestyle brands. Founded in 1990, Munchkin is the leading consumer product company and most loved baby lifestyle brand behind the innovative gear and products for children, mothers and caregivers. Munchkin has sold billions of dollars of products..."
org-spectrum,Spectrum,company,built_in;la;companies,Researching,Los Angeles,,,startup_directory,https://www.builtinla.com/company/spectrum-0,2026-05-27T12:03:09+00:00,2026-05-27T12:03:09+00:00,"team_size=100,000 Employees | location=7 Offices | jobs_count=1 | tags=information technology,internet of things,mobile,on-demand,software | description=Our Product and Technology team creates, develops, and operates the nation’s fastest mobile service, most reliable internet service, most viewed live TV app, and the most advanced WiFi, serving nearly 100 million users and 500 million devices. We are transforming the next era of connectivity and entertainment experiences together. The experience within Spectrum’s Product and Technology team is unmatched and there..."
org-taboola,Taboola,company,built_in;la;companies,Researching,Los Angeles,,,startup_directory,https://www.builtinla.com/company/taboola,2026-05-27T12:03:09+00:00,2026-05-27T12:03:09+00:00,"team_size=1,900 Employees | location=33 Offices | jobs_count=1 | tags=adtech,big data,digital media,marketing tech | description=Taboola empowers businesses to grow through performance advertising technology that goes beyond search and social and delivers measurable outcomes at scale. Taboola works with thousands of businesses who advertise directly on Realize, Taboola’s powerful ad platform, reaching approximately 600M daily active users across some of the best publishers in the world. Publishers like NBC News, Yahoo, and OEMs such as Samsung,..."
org-product-ai,Product.ai,company,built_in;la;companies,Researching,Los Angeles,,,startup_directory,https://www.builtinla.com/company/productai,2026-05-27T12:03:09+00:00,2026-05-27T12:03:09+00:00,"team_size=25 Employees | location=Los Angeles | jobs_count=1 | tags=artificial intelligence,big data,consumer web,ecommerce | description=Product.ai (formerly Demand.io) is the truth layer for commerce. Built on Axiomatic Intelligence — a proprietary adversarial reasoning methodology that stress-tests product claims against physics, economics, and engineering constraints — Product.ai delivers verified purchase verdicts, not summaries. Product.ai tells consumers when NOT to buy. Product.ai emerges from Demand.io, a profitable, bootstrapped AI commerce company whose SimplyCodes platform processes over $1B..."
org-onshore,Onshore,company,built_in;la;companies,Researching,Los Angeles,,,startup_directory,https://www.builtinla.com/company/onshore,2026-05-27T12:03:09+00:00,2026-05-27T12:03:09+00:00,"team_size=60 Employees | location=3 Offices | jobs_count=1 | tags=artificial intelligence,fintech,software,financial services | description=Traditional firms rely on interviews, retroactive documentation, and billable hours. Onshore applies AI at the point of substantiation, providing documentation tied directly to source data and pairing it with expert review. The result is defensible, audit-ready work delivered in weeks, not quarters. We help companies claim R&D Tax Credits, 179D Deductions, and Cost Segregation with proof, not process. 500+ companies have trusted Onshore..."
org-bellagent,Bellagent,company,built_in;la;companies,Researching,Los Angeles,,,startup_directory,https://www.builtinla.com/company/bellagent,2026-05-27T12:03:09+00:00,2026-05-27T12:03:09+00:00,"team_size=20 Employees | location=3 Offices | jobs_count=1 | tags=artificial intelligence,machine learning,business intelligence,generative ai | description=Bellagent is an enterprise-level AI agent platform built to automate everyday business operations with zero-touch integrations that connect instantly to more than 1,300 applications. Launched in 2025 by Proactifi Inc., and headquartered in Chicago, the platform is built for practicality with industry-leading compliance and security standards, enabling organizations to deploy AI agents without friction from day one. Bellagent’s mission to..."
org-cloudflare,Cloudflare,company,built_in;la;companies,Researching,Los Angeles,,,startup_directory,https://www.builtinla.com/company/cloudflare,2026-05-27T12:03:09+00:00,2026-05-27T12:03:09+00:00,"team_size=4,400 Employees | location=13 Offices | jobs_count=1 | tags=cloud,information technology,security,software,cybersecurity | description=Cloudflare, Inc. (NYSE: NET) is the leading connectivity cloud company on a mission to help build a better Internet. It empowers organizations to make their employees, applications and networks faster and more secure everywhere, while reducing complexity and cost. Cloudflare’s connectivity cloud delivers the most full-featured, unified platform of cloud-native products and developer tools, so any organization can gain the..."
org-people-inc,People Inc.,company,built_in;la;companies,Researching,Los Angeles,,,startup_directory,https://www.builtinla.com/company/people-inc-5,2026-05-27T12:03:09+00:00,2026-05-27T12:03:09+00:00,"team_size=3,500 Employees | location=7 Offices | jobs_count=1 | tags=adtech,consumer web,digital media,ecommerce,marketing tech | description=People Inc. is America’s largest digital and print publisher. Our 40+ iconic and fast-growing brands harness the best intent-driven content, the fastest sites, and the fewest ads to help nearly 200 million people every month, including 95 percent of US women, make decisions, take action, and find inspiration. People Inc. brands include PEOPLE, Better Homes & Gardens, Verywell, FOOD &..."
org-magnite,Magnite,company,built_in;la;companies,Researching,Los Angeles,,,startup_directory,https://www.builtinla.com/company/magnite,2026-05-27T12:03:09+00:00,2026-05-27T12:03:09+00:00,"team_size=950 Employees | location=19 Offices | jobs_count=1 | tags=adtech,big data,digital media,software | description=Together, we power advertising that enables billions of people to stay informed, entertained, and connected. We introduce them to new ideas, products, and services that make their lives better. And we help media owners of all sizes realize their full potential. That’s a lot — that’s the power of advertising. But it’s only possible with great technology. And that’s where Magnite..."
org-golden-hippo,Golden Hippo,company,built_in;la;companies,Researching,Los Angeles,,,startup_directory,https://www.builtinla.com/company/golden-hippo,2026-05-27T12:03:10+00:00,2026-05-27T12:03:10+00:00,"team_size=500 Employees | location=Los Angeles | jobs_count=1 | tags=digital media,ecommerce,information technology,marketing tech,retail,social media,analytics | description=With over 900 team members across multiple companies dedicated to improving lives, we create best-in-class products that bring health and happiness. Our creative content educates the world on making smarter health choices, while the brands we own generate over $600 million of revenue annually. From brand ideation to ad creation to product fulfillment, the entire process happens in-house."
org-square,Square,company,built_in;la;companies,Researching,Los Angeles,,,startup_directory,https://www.builtinla.com/company/square,2026-05-27T12:03:10+00:00,2026-05-27T12:03:10+00:00,"team_size=12,000 Employees | location=18 Offices | jobs_count=1 | tags=ecommerce,fintech,hardware,payments,software,financial services | description=Since we opened our doors in 2009, the world of commerce has evolved immensely, and so has Square. After enabling anyone to take payments and never miss a sale, we saw sellers stymied by disparate, outmoded products and tools that wouldn’t work together. So we expanded into software and started building integrated, omnichannel solutions – to help sellers sell online, manage..."
org-genius-sports,Genius Sports,company,built_in;la;companies,Researching,Los Angeles,,,startup_directory,https://www.builtinla.com/company/genius-sports,2026-05-27T12:03:10+00:00,2026-05-27T12:03:10+00:00,"team_size=1,800 Employees | location=13 Offices | jobs_count=1 | tags=adtech,artificial intelligence,machine learning,marketing tech,software,sports,big data analytics | description=Genius Sports is the layer between what happens on the field and how the world engages with it. Our solutions across the global sports ecosystem are underpinned by our next generation big data and artificial intelligence platform, GeniusIQ. By ingesting and computing multiple real-time data feeds, GeniusIQ powers a wide range of functions and applications across sports performance and officiation, fan engagement,..."
org-crunchyroll,Crunchyroll,company,built_in;la;companies,Researching,Los Angeles,,,startup_directory,https://www.builtinla.com/company/crunchyroll,2026-05-27T12:03:10+00:00,2026-05-27T12:03:10+00:00,"team_size=1,300 Employees | location=14 Offices | jobs_count=1 | tags=digital media,ecommerce,gaming,mobile,news+entertainment | description=At Crunchyroll, we deliver what anime fans love—anytime, anywhere. With the world’s largest anime streaming library, we connect fans to the stories, characters, and creators they love. But Crunchyroll is more than just a destination to watch anime—it's a global ecosystem where anime lives and breathes beyond the screen. From streaming and theatrical releases to merch, games, news, events, and music, we..."
org-floqast,FloQast,company,built_in;la;companies,Researching,Los Angeles,,,startup_directory,https://www.builtinla.com/company/floqast,2026-05-27T12:03:10+00:00,2026-05-27T12:03:10+00:00,"team_size=800 Employees | location=5 Offices | jobs_count=1 | tags=artificial intelligence,fintech,software | description=By automating and streamlining common accounting workflows to make them more efficient, FloQast is where accounting teams want to work so they can focus on what matters most, even when that’s just logging off on time. Whether automating reconciliations, documentation requests, or streamlining recurring accounting processes, such as the month-end close, financial reporting, or payroll, FloQast's platform enhances the way..."
org-first-entertainment-credit-union,First Entertainment Credit Union,company,built_in;la;companies,Researching,Los Angeles,,,startup_directory,https://www.builtinla.com/company/first-entertainment-credit-union,2026-05-27T12:03:10+00:00,2026-05-27T12:03:10+00:00,"team_size=225 Employees | location=Los Angeles | jobs_count=1 | tags=fintech,financial services | description=Named one of the top 10 Credit Union in California by Forbes, First Entertainment Credit Union has been the financial ally since 1967 for the creators of entertainment and those who support them. With more than 2.1 billion in assets and over 90,000 members, we are constantly looking for talents to help us build a high trust, high performance and..."
org-cash-app,Cash App,company,built_in;la;companies,Researching,Los Angeles,,,startup_directory,https://www.builtinla.com/company/cash-app,2026-05-27T12:03:10+00:00,2026-05-27T12:03:10+00:00,"team_size=3,500 Employees | location=14 Offices | jobs_count=1 | tags=blockchain,fintech,mobile,payments,software,financial services | description=Initially built to take the pain out of peer-to-peer payments, Cash App has gone from a simple product with a single purpose to a dynamic app, bringing a better way to send, spend, invest, borrow and save to our millions of monthly active users. With a mission to redefine the world's relationship with money by making it more relatable, instantly..."
org-wells-fargo,Wells Fargo,company,built_in;sf;companies,Researching,San Francisco,,,startup_directory,https://www.builtinsf.com/company/wells-fargo,2026-05-27T12:03:10+00:00,2026-05-27T12:03:10+00:00,"team_size=205,000 Employees | location=12 Offices | jobs_count=1 | tags=fintech,financial services | description=Wells Fargo & Company (NYSE: WFC) is a leading financial services company that has approximately $2.1 trillion in assets. We provide a diversified set of banking, investment and mortgage products and services, as well as consumer and commercial finance, through our four reportable operating segments: Consumer Banking and Lending, Commercial Banking, Corporate and Investment Banking, and Wealth & Investment Management...."
org-headway,Headway,company,built_in;sf;companies,Researching,San Francisco,,,startup_directory,https://www.builtinsf.com/company/headway,2026-05-27T12:03:10+00:00,2026-05-27T12:03:10+00:00,"team_size=819 Employees | location=3 Offices | jobs_count=1 | tags=consumer web,healthtech,professional services,social impact,software | description=Headway’s mission is a big one – to build a new mental health care system everyone can access. We’ve built technology that helps people find great therapists with the first software-enabled national network of providers accepting insurance. 1 in 4 people in the US have a treatable mental health condition, but the majority of providers don’t accept insurance, making therapy..."
org-toast,Toast,company,built_in;sf;companies,Researching,San Francisco,,,startup_directory,https://www.builtinsf.com/company/toast,2026-05-27T12:03:10+00:00,2026-05-27T12:03:10+00:00,"team_size=5,000 Employees | location=10 Offices | jobs_count=1 | tags=cloud,fintech,food,information technology,software,hospitality | description=Toast is the all-in-one platform built for restaurants of all sizes. Toast provides a single platform of software as a service (SaaS) products and financial technology solutions that give restaurants everything they need to run their business, including point of sale, payments, supplier management, digital ordering and delivery, marketing and loyalty, and team management. By serving as the restaurant operating..."
org-doximity,Doximity,company,built_in;sf;companies,Researching,San Francisco,,,startup_directory,https://www.builtinsf.com/company/doximity,2026-05-27T12:03:10+00:00,2026-05-27T12:03:10+00:00,"team_size=740 Employees | location=Fully Remote | jobs_count=1 | tags=healthtech,information technology,mobile,productivity,software,analytics,telehealth | description=Founded in 2010, Doximity is the leading digital platform for U.S. medical professionals. Our network members include over 80% of U.S. physicians across all states and every medical specialty. Our mission is to help every physician be more productive and provide better care for their patients. We are physicians-first, putting technology to work for doctors instead of the other way around...."
org-fareharbor,FareHarbor,company,built_in;sf;companies,Researching,San Francisco,,,startup_directory,https://www.builtinsf.com/company/fareharbor,2026-05-27T12:03:10+00:00,2026-05-27T12:03:10+00:00,"team_size=960 Employees | location=6 Offices | jobs_count=1 | tags=sales,software,travel | description=Founded in 2013 in Hawaii and acquired by Booking Holdings in 2018, FareHarbor creates powerful tools that enable our clients (think boat rentals, museums, food tours, events and more!) to operate and grow. With over 20,000 clients across 90+ countries—we’re the largest in our industry and shaping the future of travel, together. Our team is an ‘Ohana of 900+..."
org-grow-therapy,Grow Therapy,company,built_in;sf;companies,Researching,San Francisco,,,startup_directory,https://www.builtinsf.com/company/grow-therapy,2026-05-27T12:03:10+00:00,2026-05-27T12:03:10+00:00,"team_size=460 Employees | location=3 Offices | jobs_count=1 | tags=healthtech,social impact,software | description=We see technology not as a layer on top of care, but as the connective tissue that helps it grow. Grow Therapy is an online therapy platform that helps you find a therapist who gets you—and takes your insurance. Grow was founded to create end-to-end systems that make therapy easier on both sides: helping therapists launch and grow thriving private practices..."
org-gusto,Gusto,company,built_in;sf;companies,Researching,San Francisco,,,startup_directory,https://www.builtinsf.com/company/gusto,2026-05-27T12:03:10+00:00,2026-05-27T12:03:10+00:00,"team_size=4,405 Employees | location=4 Offices | jobs_count=1 | tags=fintech,hr tech | description=Gusto is a modern, online small business platform that helps small businesses take care of their teams. On top of full-service payroll, Gusto offers health insurance, 401(k)s, expert HR, and team management tools. Today, Gusto offices in Denver, San Francisco, and New York serve more than 400,000 businesses. Our customers come from all walks of life, and so do we. We..."
org-logicmonitor,LogicMonitor,company,built_in;sf;companies,Researching,San Francisco,,,startup_directory,https://www.builtinsf.com/company/logicmonitor,2026-05-27T12:03:10+00:00,2026-05-27T12:03:10+00:00,"team_size=1,100 Employees | location=8 Offices | jobs_count=1 | tags=artificial intelligence,cloud,information technology,machine learning,software | description=LogicMonitor® is the AI-first hybrid observability platform powering the next generation of digital infrastructure. LogicMonitor delivers complete visibility and actionable intelligence across on-premises, cloud, and edge environments. By anticipating issues before they strike, optimizing resources in real time, and enabling faster, smarter decisions, LogicMonitor helps IT and business leaders protect margins, accelerate innovation, and deliver exceptional digital experiences without compromise...."
org-zynga,Zynga,company,built_in;sf;companies,Researching,San Francisco,,,startup_directory,https://www.builtinsf.com/company/zynga,2026-05-27T12:03:10+00:00,2026-05-27T12:03:10+00:00,"team_size=2,449 Employees | location=6 Offices | jobs_count=1 | description=Zynga was founded in 2007 with the vision that play would become one of the core activities on the Internet. We pioneered social games with the belief that if we could make games simple, accessible and social the world would start playing. We are excited that games have grown to become the second most popular activity by time spent, even..."
org-sofi,SoFi,company,built_in;sf;companies,Researching,San Francisco,,,startup_directory,https://www.builtinsf.com/company/sofi,2026-05-27T12:03:10+00:00,2026-05-27T12:03:10+00:00,"team_size=4,500 Employees | location=7 Offices | jobs_count=1 | tags=fintech,mobile,software,financial services | description=SoFi wasn’t built to be a bank. Or a technology company. We were built for one mission: help people achieve financial independence so they can realize their ambitions. Redefining an entire industry isn’t easy work—and it’s not for the faint of heart. It takes a certain kind of team. People with diverse perspectives and expertise, united by a common sense of..."
