organization_id,name,organization_type,target_lists,status,city,website,linkedin_url,source_kind,source_url,discovered_at,last_updated_at,notes
org-aseon-labs,Aseon Labs,startup,yc;startup;sf;hiring,Researching,Redwood City,,,yc_directory,https://www.ycombinator.com/companies/aseon-labs,2026-05-27T12:03:06+00:00,2026-05-27T12:03:06+00:00,"batch=P2026 | team_size=5 employees | location=Redwood City, CA, USA | jobs_count=1 | tags=self-driving-vehicles,machine-learning,robotics,hardware,artificial-intelligence | description=Aseon Labs builds robotic pitstops for self-driving cars. A depot in a box for charging, cleaning & inspecting autonomous fleets directly in operating zones. Autonomous driving is working. The operational layer around it is not. Today, fleets lose significant time and money traveling to centralized depots for charging, cleaning and servicing, creating dead miles, lower uptime and operational bottlenecks that limit fleet scale. Aseon Pods are modular, rapidly deployable robotic pitstops that keep autonomous fleets operating near demand. By bringing charging, cleaning and inspection directly into operating zones, we help fleet operators increase uptime, reduce operational overhead and scale markets more efficiently without relying on large centralized depots. We’re second-time founders and mobility infrastructure operators. Previously, we built and scaled Pushme to 5,000 stations across 40 cities before its acquisition by TIER–Dott ($600M raised). Aseon Labs is backed by Y Combinator and headquartered in Redwood City."
org-the-company-company,The Company Company,startup,yc;startup;sf;hiring,Researching,San Francisco,,,yc_directory,https://www.ycombinator.com/companies/the-company-company,2026-05-27T12:03:06+00:00,2026-05-27T12:03:06+00:00,batch=P2026 | team_size=1 employees | location=San Francisco | jobs_count=1 | description=The Company Company builds the agent and the infrastructure to run companies.
org-synphony,Synphony,startup,yc;startup;sf;hiring,Researching,San Carlos,,,yc_directory,https://www.ycombinator.com/companies/synphony,2026-05-27T12:03:06+00:00,2026-05-27T12:03:06+00:00,"batch=P2026 | team_size=10 employees | location=San Carlos, CA, USA | jobs_count=1 | tags=robotics,food-service-robots-&-machines,agriculture,saas | description=Strawberry farming is a $3B industry in California alone with 60% labor cost using 40-year old software. Synphony provides strawberry picking robots and software services including: bed-level analytics, data pipeline integration, and agentic solutions. Synphony's ""side hustle"" is selling data, evals, and viral demos to robot foundation labs while building capacity for general robot deployments. We've started with strawberry farming for great margins and outdoor data moat, but also received requests for robots in semi-conductors and autonomous space labs. Synphony's team has won over 15 hackathons together (taking home 4 Jensen-signed GPUs!). Sean did ML research at NVIDIA and led AI products used by IRS and Citibank. Lucas' research spanned robotics, IoT devices, and neuromorphic computing. Alex architected an app with 400k users."
org-anoria,ANORIA,startup,yc;startup;sf;hiring,Researching,San Francisco,,,yc_directory,https://www.ycombinator.com/companies/anoria,2026-05-27T12:03:06+00:00,2026-05-27T12:03:06+00:00,"batch=P2026 | team_size=5 employees | location=San Francisco | jobs_count=1 | tags=artificial-intelligence,consumer-products,consumer-health-services,hardware,mental-health-tech | description=We've spent decades tracking everything. Sleep. Recovery. Steps. All proxies for how we feel. Performance is 90% mental. And yet no one has built the feedback loop for our emotions. We close that loop by designing a device that understands how you feel, tells you why, and what you can do about it. Emotional intelligence becomes trainable, so you can better connect and create with those around you."
org-hedge,Hedge,startup,yc;startup;sf;hiring,Researching,San Francisco,,,yc_directory,https://www.ycombinator.com/companies/hedge,2026-05-27T12:03:06+00:00,2026-05-27T12:03:06+00:00,"batch=P2026 | team_size=2 employees | location=San Francisco, CA, USA | jobs_count=1 | tags=insurance,fintech,artificial-intelligence | description=Hedge is an AI-Native specialty insurance company. We help insurance brokers find faster, cheaper, and better coverage for their customers. b2b"
org-intelligence-factory,Intelligence Factory,startup,yc;startup;sf;hiring,Researching,San Francisco,,,yc_directory,https://www.ycombinator.com/companies/intelligence-factory,2026-05-27T12:03:06+00:00,2026-05-27T12:03:06+00:00,"batch=P2026 | team_size=5 employees | location=San Francisco, CA, USA | jobs_count=1 | tags=robotics,ai | description=Robotics is the new paradigm. With hardware converging, Intelligence is the biggest bottleneck. Our world was built for humans and we're giving robots the ability to reason and act like us. The way we learn any task - by seeing, doing, and feeling - is how we train robots. We're building general intelligence that works on any robot and fits seamlessly within our world."
org-bloom,Bloom,startup,yc;startup;sf;hiring,Researching,San Francisco,,,yc_directory,https://www.ycombinator.com/companies/trybloom,2026-05-27T12:03:06+00:00,2026-05-27T12:03:06+00:00,"batch=P2026 | team_size=3 employees | location=San Francisco | jobs_count=1 | description=Bloom is the brand layer for agents - a system that holds your brand and makes it callable from any agent, app, or platform. Ingest your brand from anywhere - decks, websites, social, Figma, and more. Bloom systemises your brand, enabling the creation of on-brand outputs like images, video, video, copy, and more, through the web app, the API, or MCP. We're building brand-as-infrastructure for the AI era."
org-eden-robotics,Eden Robotics,startup,yc;startup;sf;hiring,Researching,San Francisco,,,yc_directory,https://www.ycombinator.com/companies/eden-robotics,2026-05-27T12:03:06+00:00,2026-05-27T12:03:06+00:00,"batch=P2026 | team_size=4 employees | location=San Francisco, CA, USA | jobs_count=1 | tags=automation,robotics,robotic-process-automation,ai | description=We're building robots that just work and use them to deliver autonomous services at scale. Our first use case is semi-humanoid robots for manufacturing and logistics. Unlike traditional robotics companies, we don't sell robots, we provide physical agents for hire where companies pay for the robots based on usage, decreasing the barrier to entry and expanding the robotics market as a whole."
org-tasklet,Tasklet,startup,yc;startup;sf;hiring,Researching,San Francisco,,,yc_directory,https://www.ycombinator.com/companies/tasklet-2,2026-05-27T12:03:06+00:00,2026-05-27T12:03:06+00:00,"batch=P2026 | team_size=8 employees | location=San Francisco | jobs_count=1 | description=AI chatbots can answer questions, but they can't do your work — they aren't connected to your tools, can't take actions, and stop running when you close the tab. Meanwhile, knowledge workers are still spending most of their day switching between dozens of SaaS apps, manually stitching together workflows that should be automated. Tasklet is the AI agent that actually does the work. It connects to every tool you use — via thousands of built-in integrations, any HTTP API, or MCP servers — and takes real actions on your behalf: pulling reports, updating CRMs, triaging emails, processing data, and more. When it needs a UI, it generates one on the fly. When it needs to crunch numbers or do bulk operations, it writes and runs code in a cloud sandbox. When it needs to interact with a website that doesn't have an API, it uses a real browser. And because it runs in the cloud 24/7, you can set up triggers to have it take ongoing responsibility for workflows — not just do something once, but handle it going forward. The product is deliberately simple: a chat interface where you talk to an extremely capable agent. But underneath that simplicity is a cloud-native agent runtime, best-in-class context engineering, a universal connections layer, and multi-model support that keeps us on the frontier as AI improves. We think legacy SaaS is being unbundled by agents, and Tasklet is the operating system that ties it all together."
org-biostack-platforms,BioStack Platforms,startup,yc;startup;sf;hiring,Researching,San Francisco,,,yc_directory,https://www.ycombinator.com/companies/biostack-platforms,2026-05-27T12:03:06+00:00,2026-05-27T12:03:06+00:00,"batch=P2026 | location=San Francisco | jobs_count=1 | description=BioStack is building the data engine for healthcare and drug discovery AI. The bottleneck is not models. It is access to high-quality biological data. Clinical and experimental data is fragmented, unstructured, and locked inside hospitals, labs, and CROs, while generating new data is slow and expensive. BioStack fixes this with proprietary clinical and preclinical data pipelines that turn real biomedical workflows into ML-ready training environments. We structure longitudinal multimodal data across imaging, EHR, and experimental assays, then package it for post-training and reinforcement learning so models can learn how research and care actually happen. Instead of static datasets, BioStack gives AI labs workflow-aligned data and environments that improve reasoning, decision-making, and real-world performance in biology and medicine."
org-whatnot,Whatnot,startup,yc;startup;la,Discovered,Los Angeles,,,yc_directory,https://www.ycombinator.com/companies/whatnot,2026-05-27T12:03:07+00:00,2026-05-27T12:03:07+00:00,"batch=W2020 | team_size=731 employees | location=Los Angeles, CA, USA | tags=marketplace,e-commerce | description=Whatnot is the largest livestream shopping platform in the U.S., connecting buyers and sellers in real-time across any category – from collectibles like trading cards to comics, fashion, sneakers, and more."
org-honeylove,Honeylove,startup,yc;startup;la,Discovered,Los Angeles,,,yc_directory,https://www.ycombinator.com/companies/honeylove,2026-05-27T12:03:07+00:00,2026-05-27T12:03:07+00:00,"batch=S2018 | team_size=100 employees | location=Los Angeles, CA, USA | tags=smart-clothing | description=Honeylove is a DTC startup founded by EDM artist Betsie Larkin. After searching high and low for quality shapewear that made her feel confident on stage, Betsie decided to create her own line of stage-worthy shapewear and launched publicly in 2018. Since then, Honeylove has expanded to tops, bras, and many other garments that have set new standards in their verticals. We apply a technical and artistic approach to problems we see in the fashion industry, creating products that serve our customers of all shapes, sizes, and backgrounds."
org-coinbase,Coinbase,startup,yc;startup;la,Discovered,Los Angeles,,,yc_directory,https://www.ycombinator.com/companies/coinbase,2026-05-27T12:03:07+00:00,2026-05-27T12:03:07+00:00,"batch=S2012 | team_size=6,112 employees | location=Los Angeles | description=Founded in June of 2012, Coinbase is a digital currency wallet and platform where merchants and consumers can transact with new digital currencies like bitcoin, ethereum, and litecoin. Our vision is to bring more innovation, efficiency, and equality of opportunity to the world by building an open financial system. Our first step on that journey is making digital currency accessible and approachable for everyone. Two principles guide our efforts. First, be the most trusted company in our domain. Second, create user-focused products that are easier and more intuitive to use. crypto-web3"
org-goat-group,GOAT Group,startup,yc;startup;la,Discovered,Los Angeles,,,yc_directory,https://www.ycombinator.com/companies/goat-group,2026-05-27T12:03:07+00:00,2026-05-27T12:03:07+00:00,"batch=W2011 | team_size=1,600 employees | location=Los Angeles, CA, USA | tags=marketplace | description=GOAT Group represents the leading platforms for authentic sneakers, apparel and accessories. Operating four distinct brands–GOAT, Flight Club, Grailed and alias–GOAT Group has a global community of over 50M members across 170 countries. We are backed by some of the leading names in venture capital including Accel Partners, Andreessen Horowitz, Index Ventures, Matrix Partners, NEA, SV Angel, Upfront Ventures, Webb Investment Network and Y Combinator."
org-advanced-metal-research,Advanced Metal Research,startup,yc;startup;la,Discovered,Los Angeles,,,yc_directory,https://www.ycombinator.com/companies/advanced-metal-research,2026-05-27T12:03:07+00:00,2026-05-27T12:03:07+00:00,"batch=P2026 | team_size=3 employees | location=Los Angeles, CA, USA | tags=hardware,robotics,manufacturing | description=America does not just need more welders. It needs welding knowledge that can scale. The American Welding Society projects 320,500 new welding professionals will be needed by 2029, with about 80,000 jobs to be filled annually from 2025 to 2029. More than 157,000 current welding professionals are approaching retirement. Welders are only a small share of the skilled-trades workforce, but welding accounts for an outsized share of projected capability demand. The market calls it a labor shortage. AMR sees a learning bottleneck. We are building American-made robotic welding cells that combine computer vision to provide real-time seam tracking and post-weld inspection to turn welding from a scarce manual process into a closed-loop manufacturing system that learns from every weld as it happens."
org-surtr-defense-systems,Surtr Defense Systems,startup,yc;startup;la,Discovered,Los Angeles,,,yc_directory,https://www.ycombinator.com/companies/surtr-defense-systems,2026-05-27T12:03:07+00:00,2026-05-27T12:03:07+00:00,"batch=P2026 | team_size=2 employees | location=Los Angeles, CA, USA | tags=computer-vision | description=Surtr builds ParallaxOS, the open operating system for counter-UAS. It takes sensor data from any radar, RF detector, camera, or acoustic array and fuses it into a single unified picture with AI-driven threat classification and engagement recommendations. One interface, any hardware, human in the loop."
org-ornadyne,Ornadyne,startup,yc;startup;la,Discovered,Los Angeles,,,yc_directory,https://www.ycombinator.com/companies/ornadyne,2026-05-27T12:03:07+00:00,2026-05-27T12:03:07+00:00,"batch=P2026 | team_size=2 employees | location=Los Angeles, CA, USA | tags=aerospace,hard-tech,robotics,drones | description=Ornadyne builds flapping-wing drones for reconnaissance that look, fly, and sound like birds. Today’s drones are easy to detect acoustically, visually, and electronically. As counter-UAS systems improve, traditional quadcopters and fixed-wing UAS systems are becoming increasingly ineffective for close-range surveillance. Flapping-wing aircraft have existed for years, but have lacked the performance, endurance, and control required for real-world deployment. We’re changing that by engineering a high-performance, stealth-optimized system built from first principles for efficiency, autonomy, and reliable field use. The final frontier of surveillance won’t look like machines; it will look like wildlife already in the sky. Maybe birds aren't real?"
org-alt-x,Alt-X,startup,yc;startup;la,Discovered,Los Angeles,,,yc_directory,https://www.ycombinator.com/companies/alt-x,2026-05-27T12:03:07+00:00,2026-05-27T12:03:07+00:00,"batch=W2026 | team_size=2 employees | location=Los Angeles | description=Alt-X is building the Cursor for financial modeling in Excel, an Excel agent that you can actually trust. Private-market investing still runs on Excel. Every year, trillions of dollars in real estate and private-equity deals are underwritten through manual spreadsheet work — copying numbers from PDFs, CIMs, and data rooms into fragile models that analysts rebuild from scratch. Alt-X is the AI underwriting layer for Excel. It turns raw deal materials into clean, auditable financial models inside Excel, automatically extracting key metrics and generating institutional-grade underwriting models that analysts can immediately review and edit. Building reliable AI workflows for financial models is difficult. Underwriting models contain thousands of interdependent formulas across multiple sheets, and small errors can materially change investment decisions. Alt-X focuses on making model generation and data extraction reliable enough for real deal workflows, not just demos. We built our product to underwrite billions. Ryan Samadi (Stanford CS/AI, former Citadel trader) and Michael Wachsmann (Cornell CS, infrastructure engineer) have spent years building systems around financial data and modeling workflows. We have hundreds of millions in AUM using us already, and our users already prefer us to legacy cash flow modeling tools in the real estate space. Private markets remain one of the largest manual workflows in finance. Alt-X’s goal is to become the default infrastructure layer for underwriting private-market investments inside Excel."
org-absurd,Absurd,startup,yc;startup;la,Discovered,Los Angeles,,,yc_directory,https://www.ycombinator.com/companies/absurd,2026-05-27T12:03:07+00:00,2026-05-27T12:03:07+00:00,"batch=F2025 | team_size=6 employees | location=Los Angeles | tags=generative-ai,video,marketing,media,advertising | description=Absurd makes AI brand and performance ads at scale. Our last video for Kalshi (""Election Day"") did 1M+ views, and our videos average 400K+ organic views. Companies like Hims, Kalshi, Replit, and Brex use Absurd to create production-quality videos in 72 hours. We do it with a multi-agent orchestration layer, working closely with your team from concept to final cut. Try it at absurd.com"
org-pixley-ai,Pixley AI,startup,yc;startup;la,Discovered,Los Angeles,,,yc_directory,https://www.ycombinator.com/companies/pixley-ai,2026-05-27T12:03:07+00:00,2026-05-27T12:03:07+00:00,"batch=F2025 | team_size=2 employees | location=Los Angeles | tags=ai-enhanced-learning,generative-ai,ai | description=Pixley is the first platform where kids can turn their drawings and ideas into fully animated cartoons in minutes. In just 3 weeks after launch, over 1000 families across 75 countries have already started creating stories. We’re starting with a clear wedge: personalized kids’ entertainment. Parents are tired of overstimulating, low-value content from YouTube and Netflix. Pixley gives them safe and personalized stories that encourage learning and imagination. But kids’ cartoons are just the beginning. As video generation improves, all video content will shift from manual production to being personalized and generated. Our long-term goal is to build the AI Netflix: a platform where shows and movies aren’t recommended, but instead generated around each viewer’s interests and habits. We’re 19 year old CS dropouts who’ve known each other since elementary school and won 4 hackathons at 15. After seeing AI flood the internet with low-quality content, we created Pixley – a safe, personalized way for kids to turn their ideas into animated stories."
org-primer,Primer,startup,yc;startup;la,Discovered,Los Angeles,,,yc_directory,https://www.ycombinator.com/companies/primer,2026-05-27T12:03:07+00:00,2026-05-27T12:03:07+00:00,"batch=F2025 | team_size=2 employees | location=Los Angeles | tags=saas,sales,customer-support,artificial-intelligence | description=Primer is an AI agent that sells, onboards, and supports users automatically through live, personalized walkthroughs."
org-wardstone,Wardstone,startup,yc;startup;la,Discovered,El Segundo,,,yc_directory,https://www.ycombinator.com/companies/wardstone,2026-05-27T12:03:07+00:00,2026-05-27T12:03:07+00:00,"batch=F2025 | team_size=5 employees | location=El Segundo, CA, USA | description=Wardstone is a space defense-tech company developing next-generation capabilities to protect the United States and its allies from missiles and other space-based threats. We design, build, and deploy satellites equipped with space-based interceptors to kinetically counter hypersonic and ballistic missiles."
org-pares-ai,PARES AI,startup,yc;startup;la,Discovered,Los Angeles,,,yc_directory,https://www.ycombinator.com/companies/pares-ai,2026-05-27T12:03:07+00:00,2026-05-27T12:03:07+00:00,"batch=S2025 | team_size=3 employees | location=Los Angeles | tags=real-estate,conversational-ai,ai,proptech | description=PARES is an AI-native real estate services firm, providing investment sales brokerage, leasing, property management, and acquisition advisory to institutional and middle-market property owners and investors across the country. Real estate is an extremely labor-intensive business, often requiring scaling headcount to grow, being extremely local to submarkets, and operating on low margins. With AI, these services can be centralized and delivered better, faster, and at a fraction of the cost. AI-native brokerage: - Prospecting sellers through automated inbound and outbound outreach - Underwriting deals and producing marketing materials with speed and precision - Surfacing hidden buyers, running the marketing process, and negotiating contracts - Handling all back-office, accounting, and additional support AI-native property management: - Communicating with tenants and vendors around the clock - Screening leasing prospects, sending applications, and drafting leases - Collecting rents, making payments, and chasing delinquencies - Running accounting, payroll, and owner reporting Check us out at https://www.pares.ai/"
org-habit,HABIT,startup,yc;startup;la,Discovered,El Segundo,,,yc_directory,https://www.ycombinator.com/companies/habit,2026-05-27T12:03:07+00:00,2026-05-27T12:03:07+00:00,"batch=P2025 | location=El Segundo, CA, USA | tags=retail,consumer,robotics,ai | description=Every month, our robots greet tens of thousands of Americans with a smile. They answer questions, upsell customers, and can be trained just like a human employee. b2b"
org-mindfort,MindFort,startup,yc;startup;la,Discovered,Los Angeles,,,yc_directory,https://www.ycombinator.com/companies/mindfort,2026-05-27T12:03:07+00:00,2026-05-27T12:03:07+00:00,"batch=P2025 | team_size=5 employees | location=Los Angeles | description=MindFort is building fully autonomous AI agents powered by their in-house models that can find, exploit, and patch complex vulnerabilities in web applications at massive scale. MindFort agents use the same principles as human penetration testers to understand their target and figure out the best ways to work together to exploit it. We can do fully autonomous AI web pentesting and bring offensive security to teams out numbered. While security teams were already behind with legacy tools and processes, AI coding is make the problem worse. AI generates code far faster than human teams can secure it; MindFort can match that speed and scale. Our agents will become critical as organizations scale up development with AI."
org-chrt,chrt,startup,yc;startup;la,Discovered,Los Angeles,,,yc_directory,https://www.ycombinator.com/companies/chrt,2026-05-27T12:03:07+00:00,2026-05-27T12:03:07+00:00,"batch=P2025 | team_size=5 employees | location=Los Angeles | description=chrt is a logistics platform for time-critical shipping. We enable businesses to deliver their most critical items same-day. Time-Critical Logistics is a $30B market growing at a 20% CAGR driven by growth in American healthcare and manufacturing. Businesses that place time-critical orders are enterprises who have urgent items they need to deliver ASAP. These orders are critical in nature and often require white glove service -- think therapeutic treatments for healthcare providers or specialized equipment for manufacturers. chrt builds the software for forwarders and professional couriers who pick up and deliver these orders. Couriers use chrt to coordinate and track their shipments, including a driver app and fleet management tools. Forwarders use chrt to dispatch couriers, book flights, and track time-critical orders from start to finish. Shippers use chrt to place these orders with their providers and to monitor everything. In addition, we also sell physical tracking devices that can be used to track valuable cargo or assets. This gives us full control of the shipment and allows us to provide shippers with end-to-end tracking. It also allows us to intervene early if we notice something is going wrong. We’re software engineers that became friends years ago at McKinsey. Kyle is an expert in Time-Critical Logistics, having led strategy at a leader in the space. Aaron is an expert at designing and implementing AI systems to handle complex coordination. We were shipping code together on nights and weekends for years before chrt; now we’re also shipping freight."
org-notus-autonomous-systems,Notus Autonomous Systems,startup,yc;startup;la,Discovered,Los Angeles,,,yc_directory,https://www.ycombinator.com/companies/notus-autonomous-systems,2026-05-27T12:03:07+00:00,2026-05-27T12:03:07+00:00,"batch=P2025 | team_size=3 employees | location=Los Angeles | tags=ai,drones,robotics | description=We are making drone swarms of arbitrary size which are strategically immune to RF interference using phased arrays at 60GHz steered by a novel radar algorithm. 3d-printing"
org-vassar-robotics,Vassar Robotics,startup,yc;startup;la,Discovered,Los Angeles,,,yc_directory,https://www.ycombinator.com/companies/vassar-robotics,2026-05-27T12:03:07+00:00,2026-05-27T12:03:07+00:00,"batch=P2025 | team_size=3 employees | location=Los Angeles | description=We build home humanoids the practical way—an open, mass-produced developer kit powering a real-home teleop data flywheel to autonomy, giving families back 20 hours/week."
